{"$schema":"http://json-schema.org/draft-07/schema#","title":"candidate.v1","type":"object","additionalProperties":false,"required":["schema","work_id","attempt","content_digest","files","produced_by","produced_at"],"properties":{"schema":{"const":"candidate.v1"},"work_id":{"type":"string","pattern":"^[0-9a-f]{64}$"},"attempt":{"type":"integer","minimum":1},"content_digest":{"type":"string","pattern":"^[0-9a-f]{64}$"},"files":{"type":"array","items":{"type":"object","additionalProperties":false,"required":["path","sha256"],"properties":{"path":{"type":"string","description":"Relative path using POSIX separators only; absolute and parent-traversal paths are forbidden.","pattern":"^(?!.*\\x00)(?!/)(?![A-Za-z]:)(?!.*\\\\)(?!\\.\\.(/|$))(?!.*(^|/)\\.\\.(/|$)).+$"},"sha256":{"type":"string","pattern":"^[0-9a-f]{64}$"}}}},"produced_by":{"type":"object","additionalProperties":false,"required":["carrier","session_ref"],"properties":{"carrier":{"type":"string"},"session_ref":{"type":"string"}}},"produced_at":{"type":"string","pattern":"^\\d{4}-\\d{2}-\\d{2}T[^ ]+Z$","format":"date-time"}}}
