{"schema":"candidate.v1","work_id":"aaaaaaaaaaaaaaaaaaaaaaaaaaaaaaaaaaaaaaaaaaaaaaaaaaaaaaaaaaaaaaaa","attempt":1,"content_digest":"bbbbbbbbbbbbbbbbbbbbbbbbbbbbbbbbbbbbbbbbbbbbbbbbbbbbbbbbbbbbbbbb","files":[{"path":"a.txt","sha256":"cccccccccccccccccccccccccccccccccccccccccccccccccccccccccccccccc"}],"produced_by":{"carrier":"x","session_ref":"s"},"produced_at":"2026-01-01T00:00:00Z"}
